{
  "id": "89f48de7-e963-41a7-a800-10b69af6e0d3",
  "name": "Beleg",
  "gender": "male",
  "species": "Man",
  "birth": {
    "era": "Third Age",
    "year": 610
  },
  "death": null,
  "houses": [
    "Dunedain"
  ],
  "sourceLinks": [
    {
      "label": "Tolkien Gateway",
      "url": "https://tolkiengateway.net/wiki/Special:Search?search=Beleg"
    }
  ],
  "metadata": {
    "description": "Chieftain of the Dúnedain."
  }
}
