{
  "id": "dfa7f4ad-85a3-4556-b119-67f80664f75d",
  "name": "Silmariën",
  "gender": "female",
  "species": "Man",
  "birth": {
    "era": "Second Age",
    "year": 521
  },
  "death": {
    "era": "Second Age",
    "year": null
  },
  "houses": [
    "Dunedain"
  ],
  "sourceLinks": [
    {
      "label": "Tolkien Gateway",
      "url": "https://tolkiengateway.net/wiki/Silmariën"
    }
  ],
  "metadata": {
    "description": "Daughter of Tar-Elendil, ancestor of the Lords of Andúnie."
  }
}
