{
  "id": "550e8400-e29b-41d4-a716-446655440016",
  "name": "Gidlis",
  "gender": "female",
  "birth": null,
  "death": null,
  "houses": [],
  "sourceLinks": [
    {
      "label": "Tolkien Gateway",
      "url": "https://tolkiengateway.net/wiki/Special:Search?search=Gidlis"
    }
  ],
  "metadata": {
    "description": "Mother of Galdor"
  },
  "species": "Man"
}
