{
  "id": "61afd395-dae6-42b2-a236-9c2b6501cfce",
  "name": "Arantar",
  "gender": "male",
  "species": "Man",
  "birth": {
    "era": "Third Age",
    "year": 130
  },
  "death": null,
  "houses": [
    "Dunedain"
  ],
  "sourceLinks": [
    {
      "label": "Tolkien Gateway",
      "url": "https://tolkiengateway.net/wiki/Special:Search?search=Arantar"
    }
  ],
  "metadata": {
    "description": "Chieftain of the Dúnedain."
  }
}
