{
  "id": "d4e5f6a7-b8c9-4d0e-1f2a-3b4c5d6e7f04",
  "name": "Galadriel",
  "gender": "female",
  "species": "Elf",
  "birth": {
    "era": "Years of the Trees",
    "year": 1362
  },
  "death": null,
  "houses": [
    "Noldor"
  ],
  "sourceLinks": [
    {
      "label": "Tolkien Gateway",
      "url": "https://tolkiengateway.net/wiki/Galadriel"
    },
    {
      "label": "Wikipedia",
      "url": "https://en.wikipedia.org/wiki/Galadriel"
    }
  ],
  "metadata": {
    "description": "Daughter of Finarfin and Eärwen, sister of Finrod, Angrod, and Aegnor. One of the greatest Elves of the Noldor. Went to Middle-earth and became Lady of Lothlórien. Known for her wisdom, beauty, and possession of Nenya, the Ring of Water.",
    "order": 400
  }
}
