{
  "id": "6eaf1023-d415-4179-8ca5-4c6b8fa90006",
  "name": "Rían",
  "gender": "female",
  "birth": {
    "era": "First Age",
    "year": 450
  },
  "death": {
    "era": "First Age",
    "year": 473
  },
  "sourceLinks": [
    {
      "label": "Tolkien Gateway",
      "url": "https://tolkiengateway.net/wiki/R%C3%ADan"
    }
  ],
  "metadata": {
    "description": "Daughter of Belegund, wife of Huor, mother of Tuor. Singer and maker of songs. Died of grief on Haudh-en-Ndengin.",
    "yOffset": 72
  },
  "species": "Man",
  "houses": [
    "House of Bëor"
  ]
}
