{
  "id": "89ee1562-6fd9-4568-a32b-828f81700b96",
  "name": "Valandil",
  "gender": "male",
  "species": "Man",
  "birth": {
    "era": "Third Age",
    "year": 10
  },
  "death": null,
  "houses": [
    "Dunedain"
  ],
  "sourceLinks": [
    {
      "label": "Tolkien Gateway",
      "url": "https://tolkiengateway.net/wiki/Special:Search?search=Valandil"
    }
  ],
  "metadata": {
    "description": "Chieftain of the Dúnedain."
  }
}
