{
  "id": "2e039735-7d9f-4ca1-b79e-39a90b1c55ba",
  "name": "Araval",
  "gender": "male",
  "species": "Man",
  "birth": {
    "era": "Third Age",
    "year": 1490
  },
  "death": null,
  "houses": [
    "Dunedain"
  ],
  "sourceLinks": [
    {
      "label": "Tolkien Gateway",
      "url": "https://tolkiengateway.net/wiki/Special:Search?search=Araval"
    }
  ],
  "metadata": {
    "description": "Chieftain of the Dúnedain."
  }
}
