{
  "id": "f5289deb-17a0-4186-bd36-3a02a74cdf30",
  "name": "Elendil",
  "gender": "male",
  "species": "Man",
  "birth": {
    "era": "Second Age",
    "year": 3119
  },
  "death": null,
  "houses": [
    "Dunedain"
  ],
  "sourceLinks": [
    {
      "label": "Tolkien Gateway",
      "url": "https://tolkiengateway.net/wiki/Special:Search?search=Elendil"
    }
  ],
  "metadata": {
    "description": "King of the Dúnedain."
  }
}
