{
  "id": "c3d4e5f6-a7b8-4c9d-0e1f-2a3b4c5d6e02",
  "name": "Turgon",
  "gender": "male",
  "species": "Elf",
  "birth": {
    "era": "Years of the Trees",
    "year": 1300
  },
  "death": {
    "era": "First Age",
    "year": 510
  },
  "houses": [
    "Noldor"
  ],
  "sourceLinks": [
    {
      "label": "Tolkien Gateway",
      "url": "https://tolkiengateway.net/wiki/Turgon"
    }
  ],
  "metadata": {
    "description": "Second son of Fingolfin and Anairë. King of Gondolin, the hidden city he built. Father of Idril. Led his people from Nevrast to Gondolin. Perished in the Fall of Gondolin.",
    "order": 200
  }
}
