{
  "id": "g7h8i9j0-k1l2-4m3n-4o5p-6q7r8s9t0u07",
  "name": "Tatië",
  "gender": "female",
  "species": "Elf",
  "birth": {
    "era": "Years of the Trees",
    "year": null
  },
  "death": null,
  "houses": [
    "Tatyar"
  ],
  "sourceLinks": [
    {
      "label": "Tolkien Gateway",
      "url": "https://tolkiengateway.net/wiki/Tatië"
    },
    {
      "label": "Fenopaedia",
      "url": "https://www.elfenomeno.com/en/info/ver/20662/tatie"
    }
  ],
  "metadata": {
    "description": "Spouse of Tata, the second Elf-father. She was awakened by Tata at Cuiviénen during the Years of the Trees. Together with Tata and their 54 companions, they became the Tatyar ('Seconds') – the second clan of Elves. Her descendants became the ancestors of the Noldor (those who followed Finwë to Aman) and the Tatyarin Avari (those who remained behind with Morwë and/or Nurwë). Her children included Maidros and Nurwe."
  }
}
