{
  "id": "e5f6a7b8-c9d0-4e1f-2a3b-4c5d6e7f8a01",
  "name": "Maedhros",
  "gender": "male",
  "species": "Elf",
  "birth": {
    "era": "Years of the Trees",
    "year": 1480
  },
  "death": {
    "era": "First Age",
    "year": 587
  },
  "houses": [
    "Noldor"
  ],
  "sourceLinks": [
    {
      "label": "Tolkien Gateway",
      "url": "https://tolkiengateway.net/wiki/Maedhros"
    },
    {
      "label": "Wikipedia",
      "url": "https://en.wikipedia.org/wiki/Maedhros"
    }
  ],
  "metadata": {
    "description": "Maedhros the Tall, eldest son of Fëanor and Nerdanel. Lord of the House of Fëanor after his father's death. Known for his rescue by Fingon and his friendship with Fingon. Captured by Morgoth and hung from Thangorodrim. Led the Union of Maedhros. Took his own life with a Silmaril.",
    "order": 100
  }
}
