{
  "id": "550e8400-e29b-41d4-a716-446655440032",
  "name": "Belegund",
  "gender": "male",
  "birth": {
    "era": "First Age",
    "year": 422
  },
  "death": {
    "era": "First Age",
    "year": 460
  },
  "houses": [
    "House of Bëor"
  ],
  "sourceLinks": [
    {
      "label": "Tolkien Gateway",
      "url": "https://tolkiengateway.net/wiki/Belegund"
    }
  ],
  "metadata": {
    "description": "Younger son of Bregolas, father of Rían. One of Barahir's twelve followers. Killed in the Dagor Bragollach.",
    "yOffset": 72
  },
  "species": "Man"
}
