{
  "id": "fa40d5fc-c6d8-454a-bc42-7f827a767417",
  "name": "Celebrian",
  "gender": "female",
  "species": "Elf",
  "birth": {
    "era": "Second Age",
    "year": 300
  },
  "death": null,
  "houses": [
    "Noldor"
  ],
  "sourceLinks": [
    {
      "label": "Tolkien Gateway",
      "url": "https://tolkiengateway.net/wiki/Celebr%C3%ADan"
    }
  ],
  "metadata": {
    "description": "Daughter of Galadriel and Celeborn, wife of Elrond, mother of Arwen, Elladan, and Elrohir. Born in Eregion early in the Second Age.",
    "yOffset": -72
  }
}
