{
  "id": "a1b2c3d4-e5f6-4a7b-8c9d-0e1f2a3b4c01",
  "name": "Finwë",
  "gender": "male",
  "species": "Elf",
  "birth": null,
  "death": {
    "era": "Years of the Trees",
    "year": 1495
  },
  "houses": [
    "Noldor"
  ],
  "sourceLinks": [
    {
      "label": "Tolkien Gateway",
      "url": "https://tolkiengateway.net/wiki/Finwë"
    }
  ],
  "metadata": {
    "description": "First High King of the Noldor. Father of Fëanor, Fingolfin, and Finarfin."
  }
}
